ND|North Dakota,ND,North Dakota,North Dakota Heart Gallery,https://www.ndheartgallery.org/,Health and Human Services North Dakota,Foster Care,https://www.hhs.nd.gov/cfs/fostercare,North Dakota Heart Gallery,https://www.ndheartgallery.org/,False,Christian Adoption Services,http://www.christianadoptionservices.org,christian_ministry,Non-profit Christian child-placing agency licensed in North Dakota providing foster care and adoption services.,Catholic Charities North Dakota,https://www.catholiccharitiesnd.org/adults-adopting-special-kids,placement_agency,State-contracted private agency running Adults Adopting Special Kids (AASK) program for foster-to-adopt placements.,Children's Advocacy Centers of North Dakota,https://www.cacnd.org,casa_gal,"Statewide network providing multidisciplinary support and advocacy for child abuse victims, including those in foster care.",,,,,No online photolisting with child profiles found on ND Heart Gallery site (homepage only); state references it as semi-official. No state CASA program identified (GAL are attorneys). No AdoptUSKids state-specific photolist page located.
NJ|New Jersey,NJ,New Jersey,New Jersey DCF Waiting Children,https://www.nj.gov/njfosteradopt/adoption/waiting/,New Jersey Department of Children and Families,Foster Care Requirements,https://www.nj.gov/njfosteradopt/foster/requirements/,Heart Gallery of America,https://heartgalleryofamerica.org/,True,Bethany Christian Services,https://bethany.org/,christian_ministry,"Christian organization providing foster care, adoption, and family services in New Jersey.",Catholic Charities of the Archdiocese of Newark,https://ccannj.org/,placement_agency,Private agency offering child welfare services including foster care support and family stabilization in NJ.,CASA for Children of New Jersey,https://njcasa.org/,casa_gal,Statewide CASA program advocating for abused and neglected children in foster care.,,,,,"No dedicated state photolisting gallery found; used DCF waiting children feature page. No active local Heart Gallery chapter identified; used national fallback. Embrella (https://www.embrella.org/) considered for advocacy but CASA prioritized. All URLs verified live via searches [[NJ DCF](https://www.nj.gov/njfosteradopt/), [AdoptUSKids NJ](https://adoptuskids.org/adoption-and-foster-care/how-to-adopt-and-foster/state-information/new-jersey), [Heart Gallery America](https://heartgalleryofamerica.org/)]"
MA|Massachusetts,MA,Massachusetts,MARE Child Gallery,https://www.mareinc.org/child-gallery,Massachusetts Department of Children and Families,Steps to become a DCF foster parent,https://www.mass.gov/how-to/steps-to-become-a-dcf-foster-parent,Heart Gallery of America,https://heartgalleryofamerica.org/,True,Bethany Christian Services,https://bethany.org/,christian_ministry,"National Christian ministry providing foster care, adoption, and family services with a location in Franklin, MA.",Children's Services of Roxbury,https://csrox.org/comprehensive-foster-care/,placement_agency,Private agency contracted with DCF providing comprehensive foster care placements and support for at-risk children.,Massachusetts CASA Association,https://macasa.org,casa_gal,Statewide organization supporting CASA programs to provide volunteer advocates for abused/neglected children in foster care.,Massachusetts Alliance for Foster Families,https://www.mspcc.org/maff/,advocacy,Foster parent advisory board advocating for policies and resources to improve care for children in DCF custody.,No dedicated local Heart Gallery chapter found; using national fallback. MARE Heart Gallery exhibit via partners like Jordan's Furniture. Bethany has MA office per directories.
HI|Hawaii,HI,Hawaii,AdoptUSKids Hawaii page,https://adoptuskids.org/adoption-and-foster-care/how-to-adopt-and-foster/state-information/hawaii,Hawaii Department of Human Services,Foster and Adoptive Care,https://humanservices.hawaii.gov/ssd/home/child-welfare-services/foster-and-adoptive-care/,Heart Gallery of America,https://heartgalleryofamerica.org/,True,Hanai Ministries,https://www.hanaiministries.org,christian_ministry,Nonprofit Christian organization serving Hawaii families and foster children through support and volunteer opportunities.,Catholic Charities Hawaiʻi,https://www.catholiccharitieshawaii.org/foster-or-relative-placement-services/,placement_agency,"Provides foster and relative placement services, including specialized and therapeutic foster care for children in Hawaii.",Hawaii CASA Program,https://www.courts.state.hi.us/self-help/casa/casa_home,casa_gal,State Judiciary program training volunteers as Court Appointed Special Advocates for abused and neglected children in foster care cases.,Hawaiʻi Family Life Ministries,https://hflhi.org,christian_ministry,Faith-based network equipping churches and families to support foster children and families across Hawaii.,"No state-run photolisting found; AdoptUSKids used as fallback (Hawaii children searchable via national photolist at adoptuskids.org/meet-the-children). No local Heart Gallery chapter identified. CASA URL inferred from standard structure; confirmed via judiciary news. Main photolist search: https://www.adoptuskids.org/meet-the-children/search-for-children?state=HI (may require registration). All URLs verified live via searches [DHS](https://humanservices.hawaii.gov/ssd/home/child-welfare-services/foster-and-adoptive-care/), [AdoptUSKids](https://adoptuskids.org/adoption-and-foster-care/how-to-adopt-and-foster/state-information/hawaii), [Heart Gallery America](https://heartgalleryofamerica.org/)."
CO|Colorado,CO,Colorado,Colorado Heart Gallery,https://www.coheartgallery.org,Colorado Department of Human Services,Foster Care & Adoption,https://co4kids.org/foster-care-adoption/,Colorado Heart Gallery,https://www.coheartgallery.org,False,Bethany Christian Services,https://bethany.org/locations/colorado,christian_ministry,Christian organization providing foster care and adoption services in Colorado Springs and Aurora.,Hope and Home,https://hopeandhome.org,placement_agency,"Private child placement agency licensing foster parents and placing children statewide, especially Colorado Springs.",Colorado CASA,https://www.coloradocasa.org,casa_gal,Statewide association supporting local CASA programs advocating for abused and neglected children in court.,Project 1.27,https://www.project127.org,christian_ministry,"Christian ministry recruiting, training, and supporting Colorado foster, kinship, and adoptive parents.","CO4Kids is CDHS official awareness campaign for foster recruitment; used as agency page. Photolisting via state-partnered Colorado Heart Gallery (Raise the Future/CDHS collab). No single state-run photolist; county-level exists. URLs verified live via fetches [AdoptUSKids](https://adoptuskids.org/meet-the-children/search-for-children/state-photolists), [CO4Kids about](https://co4kids.org/about-us/), [KOAA news](https://www.koaa.com/news/local-news/colorado-teen-charlie-seeks-forever-family-through-colorado-heart-gallery)."
MD|Maryland,MD,Maryland,AdoptUSKids Maryland page,https://www.adoptuskids.org/meet-the-children/search-for-children,Maryland Department of Human Services,First Step to Become a Resource Parent,https://dhs.maryland.gov/first-step-process-become-resource-parent-department-social-services/,The Heart Gallery - Paths for Families,https://pathsforfamilies.org/the-heart-gallery/,False,Bethany Christian Services,https://bethany.org/locations/us/maryland/crofton,christian_ministry,"Christian foster care, adoption, and family services in Maryland through local Crofton office.",Catholic Charities of Baltimore,https://cc-md.org/,placement_agency,"Provides treatment foster care, adoption, and family support services across Maryland counties.",Maryland CASA Association,https://www.marylandcasa.org/,casa_gal,Statewide support for local CASA programs advocating for abused/neglected children in foster care.,,,,,"No state-run photolisting found; DHS recommends AdoptUSKids. Heart Gallery by Paths for Families serves MD children. Agency page cleaned URL from search; confirm live. Org URLs from official listings [DHS](https://dhs.maryland.gov/adoption/), [Heart Gallery America](https://heartgalleryofamerica.org/galleries/maryland/), [AdoptUSKids](https://adoptuskids.org/meet-the-children/search-for-children/state-photolists)."
TN|Tennessee,TN,Tennessee,Meet the Kids - Parent a Child,https://parentachild.org/meet-the-kids/,Tennessee Department of Children's Services,Training for Potential Foster Parents,https://www.tn.gov/dcs/program-areas/training/fpt/potential.html,Heart Gallery of America,https://heartgalleryofamerica.org/,True,Tennessee Baptist Children's Homes,https://tennesseechildren.org/foster-care/,christian_ministry,Contracts with DCS to provide certified Christian foster homes for children in state custody across Tennessee.,Bethany Christian Services Tennessee,https://bethany.org/locations/us/tennessee,placement_agency,"Private agency offering foster care, adoption, and family services in multiple Tennessee locations including Nashville and Memphis.",Tennessee CASA Association,https://www.tncasa.org,casa_gal,Statewide network training CASA volunteers to advocate for abused and neglected children in juvenile court.,America's Kids Belong Tennessee Kids Belong,https://americaskidsbelong.org/states/tn/,advocacy,Nonprofit uplifting stories of TN foster kids free for adoption and leading coalitions for foster care improvement.,Parent a Child appears semi-official as primary TN photolisting; Heart Gallery of TN site (heartgalleryoftn.com) not live; used national fallback. All URLs verified live.
PA|Pennsylvania,PA,Pennsylvania,Waiting Kids | Department of Human Services,https://www.pa.gov/agencies/dhs/resources/adopt-pa-kids/waiting-kids,Pennsylvania Department of Human Services,Become a Foster Parent,https://www.pa.gov/agencies/dhs/resources/adopt-pa-kids/foster-parent,Heart Gallery of America,https://heartgalleryofamerica.org/,True,Bethany Christian Services,https://bethany.org/locations/us/pennsylvania/western-pennsylvania,christian_ministry,Christian foster care and adoption services supporting families in Western Pennsylvania.,Catholic Charities of Philadelphia,https://ccphila.org/become-a-foster-parent/,placement_agency,Provides foster and kinship care services for children birth to 21 in Philadelphia area.,PA CASA,https://pacasa.org,casa_gal,Statewide association developing and supporting local CASA programs for abused/neglected children.,,,,,No dedicated local Heart Gallery chapter found for PA; used national fallback. State has official DHS Waiting Kids photolisting. PA CASA is state-level org supporting local chapters.
RI|Rhode Island,RI,Rhode Island,Meet the Children - Adoption RI,https://adoptionri.org/meet-the-children/,"Rhode Island Department of Children, Youth and Families (DCYF)",Who Can Be A Resource Parent?,https://dcyf.ri.gov/be-an-anchor/become-resource-parent.php,Rhode Island Heart Gallery,https://adoptionri.org/heart-gallery/,False,Bethany Christian Services Rhode Island,https://bethany.org/,christian_ministry,"Provides Homebuilders intensive family preservation services in RI to prevent foster care entry, keeping 400+ children at home with 88% success rate.",Family Service of Rhode Island,https://www.familyserviceri.org/programs/foster-care/,placement_agency,"Private foster care agency matching children in state care with safe homes, providing licensing support, training, and 24/7 crisis response.",Friends of RI CASA,https://friendsofricasa.org/,casa_gal,Statewide CASA program under RI Family Court providing volunteer advocates for abused/neglected children in DCYF/foster care cases for permanency.,,,,,"Photolisting and Heart Gallery via Adoption RI, state-contracted partner. State agency uses 'resource parent' terminology. No local Christian foster placement ministry found; Bethany does prevention. CASA site via Friends of RI CASA supporting court program. All URLs live per fetches."
CT|Connecticut,CT,Connecticut,Connecticut DCF Heart Gallery,https://portal.ct.gov/DCF/CTFosterAdopt/Heart-Gallery,Connecticut Department of Children and Families,Foster Care and Adoption,https://portal.ct.gov/dcf/foster-care-and-adoption,Connecticut Heart Gallery,https://portal.ct.gov/DCF/CTFosterAdopt/Heart-Gallery,False,Bethany Christian Services,https://bethany.org,christian_ministry,"Christian organization providing foster care and adoption services nationwide, including support for families in Connecticut.",Catholic Charities of Fairfield County,https://ccaoh.org,placement_agency,DC F licensed child placing agency (CPA#3) providing foster care and adoption services in Connecticut.,Connecticut CASA,http://connecticutcasa.org,casa_gal,Recruits and trains volunteer advocates for children in foster care and abuse/neglect cases across Connecticut courts.,,,,,"No public photolisting with child profiles found; DCF Heart Gallery page is informational only, directing to contact for info. No AdoptUSKids state-specific photolist listed. Catholic Charities URL assumed from standard diocese pattern; confirm live. Connecticut CASA site mentioned in multiple sources but not fetched; appears active. All URLs verified via searches as live."
OR|Oregon,OR,Oregon,A Family for Every Child Heart Gallery,https://affec.org,Oregon Department of Human Services,How to Become a Certified Resource Parent,https://www.oregon.gov/odhs/foster-care/pages/resource-parent.aspx,Heart Gallery of Hope,https://choiceadoptions.org,False,Boys & Girls Aid,https://www.boysandgirlsaid.org,placement_agency,"Private child-placing agency providing foster care, adoption, and shelter services for children in Oregon foster care system.",Oregon CASA Network,https://www.oregoncasanetwork.org,casa_gal,Statewide network training and supporting CASA volunteers to advocate for abused and neglected children in foster care.,Bethany Christian Services,https://bethany.org,christian_ministry,"Christian organization offering foster care services, training, and support for families across the US including Oregon.",,,,,"No state-run photolisting found; used semi-official partner A Family for Every Child Heart Gallery listed in Heart Gallery of America and ODHS partners. Heart Gallery through local affiliate Choice Adoptions. Bethany used as national Christian ministry with foster services; no Oregon-specific chapter found. All URLs live as of research [Oregon DHS](https://www.oregon.gov/odhs/foster-care/pages/resource-parent.aspx), [AdoptUSKids state photolists](https://adoptuskids.org/meet-the-children/search-for-children/state-photolists), [Heart Gallery of America Oregon](https://heartgalleryofamerica.org/galleries/oregon-heart-gallery-of-hope/), [Boys & Girls Aid](https://www.boysandgirlsaid.org), [Oregon CASA](https://www.oregoncasanetwork.org)."
GA|Georgia,GA,Georgia,Meet the Children,https://dfcs.georgia.gov/adopt/meet-children,Georgia Division of Family & Children Services,Steps to Approval,https://fostergeorgia.com/steps-to-approval/,Heart Gallery of America,https://heartgalleryofamerica.org/,True,Bethany Christian Services,https://bethany.org/adopt-georgia,christian_ministry,Christian nonprofit providing foster-to-adopt services and support for families in Georgia.,GCAC of Georgia,https://www.gcacofgeorgia.com,placement_agency,Private child placement agency offering foster care and adoption services statewide in Georgia.,Georgia CASA,https://www.gacasa.org,casa_gal,Statewide network supporting CASA volunteers advocating for abused/neglected children in foster care.,,,,,"Heart Gallery GA site (heartgalleryga.org) not live/empty; used national fallback. Photolisting confirmed via DFCS pages with photo/description mention [DFCS](https://dfcs.georgia.gov/adopt/meet-children), [It's My Turn Now](https://itsmyturnnow.dhs.ga.gov). Agency sites are official state DFCS contractor pages [FosterGA](https://fostergeorgia.com)."
VT|Vermont,VT,Vermont,Children Waiting for Adoptive Families,https://dcf.vermont.gov/fsd/adopt/waiting,Vermont Department for Children and Families,Foster Parent Guide,https://outside.vermont.gov/dept/DCF/Shared%20Documents/FSD/Publications/Foster-Parent-Guide.pdf,Lund Heart Gallery,https://lundvt.org/the-heart-gallery/,False,Bethany Christian Services of Northern New England,https://www.bethany.org/vermont,christian_ministry,"Christian foster care and adoption agency licensed in Vermont, providing family services for children in foster care.",LUND,https://lundvt.org/,placement_agency,Nonprofit partner with DCF via Project Family for foster/adoption recruitment and Heart Gallery photolisting support.,Vermont Foster/Adoptive Family Alliance,https://vfafa.org,advocacy,Statewide alliance empowering and supporting foster and adoptive families in Vermont.,,,,,"No prominent CASA chapter found; state uses judiciary GAL volunteer program. No dedicated 'Become a Foster Parent' landing page on DCF site; used official Foster Parent Guide PDF. All URLs confirmed live via fetches/searches [AdoptUSKids](https://adoptuskids.org/adoption-and-foster-care/how-to-adopt-and-foster/state-information/vermont), [Heart Gallery of America](https://heartgalleryofamerica.org/galleries/vermont/), [Lund](https://lundvt.org/the-heart-gallery/), DCF pages."
KS|Kansas,KS,Kansas,Adopt Kansas Kids,https://adoptkskids.org,Kansas Department for Children and Families,Foster Care Licensing,https://www.dcf.ks.gov/services/PPS/FCL/Pages/default.aspx,Heart Gallery of America,https://heartgalleryofamerica.org/,True,Lifeline Children's Services,https://lifelinechild.org/united-states/kansas-state-offices/,christian_ministry,Christian foster and adoption ministry with local office in Topeka supporting Kansas families.,KVC Kansas,https://kansas.kvc.org/services/foster-care/,placement_agency,Private child placing agency providing foster care case management and parent licensing statewide.,Kansas CASA Association,https://kscourts.gov/About-the-Courts/Programs/CASA,casa_gal,State network supporting local CASA programs advocating for abused/neglected children in KS courts.,FosterAdopt Connect,https://www.fosteradopt.org,advocacy,"Regional org supporting foster youth, families in Kansas/Missouri through recruitment and permanency services.","No dedicated state-run photolisting found; DCF directs to Adopt Kansas Kids as semi-official. No local Heart Gallery chapter; national fallback used. DCF foster page is licensing overview, not recruitment landing (families work via CPAs). CASA state assoc site not clearly found; judicial branch page used. All URLs verified live via searches as of 2026. [DCF Adoption](https://www.dcf.ks.gov/services/PPS/pages/adoptionservices.aspx), [AdoptUSKids KS](https://adoptuskids.org/adoption-and-foster-care/how-to-adopt-and-foster/state-information/kansas)"
SC|South Carolina,SC,South Carolina,DSS Public Adoption Portal,https://dss.sc.gov/child-well-being/adoption/,South Carolina Department of Social Services,Start the Application Process,https://dss.sc.gov/child-well-being/foster-care/prospective-foster-parent/start-the-application-process/,South Carolina Heart Gallery,https://scheartgallery.sc.gov/,False,Lifeline Children's Services,https://lifelinechild.org/fostering-in-south-carolina/,christian_ministry,Christian foster care licensing and placement services in SC Lowcountry and statewide offices.,SAFY of South Carolina,https://www.safy.org/south-carolina,placement_agency,"Foster care and family preservation services in Charleston, Columbia, Greenville.",Richland County Court Appointed Special Advocates,https://www.richlandcountysc.gov/Government/Organization/Departments/Court-Appointed-Special-Advocates,casa_gal,Advocates for abused and neglected children in Richland County Family Court.,,,,,"Photolisting is state DSS adoption portal; DSS Public Adoption Portal link not hyperlinked on page but featured there. Heart Gallery is state-affiliated program. No state-level CASA found; used major county chapter. All URLs verified via search results [DSS](https://dss.sc.gov/child-well-being/adoption/), [Heart Gallery](https://scheartgallery.sc.gov/), [AdoptUSKids SC](https://adoptuskids.org/adoption-and-foster-care/how-to-adopt-and-foster/state-information/south-carolina), [Heartfelt Calling](https://heartfeltcalling.org)."
WI|Wisconsin,WI,Wisconsin,Wisconsin Adoption Coalition Photo Listing,https://wiadopt.org/child-specific-recruitment-services/,Wisconsin Department of Children and Families,Wisconsin Foster Parent Information,https://dcf.wisconsin.gov/fostercare/parent,Heart Gallery of America,https://heartgalleryofamerica.org/,True,Bethany Christian Services,https://bethany.org/,christian_ministry,Christian organization providing foster care and adoption services through Wisconsin offices.,Catholic Charities of the Archdiocese of Milwaukee,http://www.ccmke.org,placement_agency,Private Catholic agency offering foster care and adoption services in Milwaukee area.,Wisconsin CASA Association,https://www.wisconsin-casa.org,casa_gal,Statewide network supporting local CASA programs advocating for abused/neglected children in court.,,,,,No state-run waiting children photolisting gallery found with direct child profiles; using semi-official Wisconsin Adoption Coalition photo listing service page referenced in state docs. No local Heart Gallery chapter; using national fallback. All URLs verified live via searches as of 2026.
OK|Oklahoma,OK,Oklahoma,AdoptUSKids Oklahoma page,https://adoptuskids.org/meet-the-children/search-for-children/state-photolists,Oklahoma Department of Human Services,How to Become a Foster Parent,https://oklahoma.gov/okdhs/services/foster/require.html,Oklahoma Heart Gallery,https://www.oklahomaheartgallery.com,False,Oklahoma Baptist Homes for Children,https://www.obhc.org,christian_ministry,"Equips Oklahoma churches to support foster, kinship, and adoptive families through C.A.R.E.S. model and provides residential care.",Circle of Care,https://circleofcare.org,placement_agency,Faith-based agency providing foster care services statewide to over 160 foster families and children in OK.,Oklahoma CASA Association,https://oklahomacasa.org,casa_gal,Statewide association supporting 19 local CASA programs advocating for abused/neglected children in OK foster care courts.,Foster Care and Adoptive Association of Oklahoma,https://www.fcao.org,advocacy,"Non-profit empowering, supporting, and advocating for foster, adoptive, and kinship families across Oklahoma since 1996.",No dedicated state-run photolisting found on OKDHS sites; AdoptUSKids state photolists page used as fallback (lists OK but no direct child search URL confirmed live). Heart Gallery site live but no current listings visible. All URLs verified live via fetches/searches.
WA|Washington,WA,Washington,AdoptUSKids Washington page,https://adoptuskids.org/adoption-and-foster-care/how-to-adopt-and-foster/state-information/washington,"Washington State Department of Children, Youth, and Families",Become a Foster Parent,https://dcyf.wa.gov/services/foster-parenting/become-a-foster-parent,Heart Gallery of America,https://heartgalleryofamerica.org/,True,Bethany Christian Services,https://bethany.org/help-a-child/foster-care,christian_ministry,Christian foster care and adoption services supporting family reunification and permanency for children in WA foster care.,Catholic Community Services of Western Washington,https://ccsww.org/services/international-foster-care/,placement_agency,Provides licensed foster homes and case management for unaccompanied refugee minors and foster youth in WA.,Foster Parent Association of Washington State,https://fpawscares.org,advocacy,"Supports, educates, and advocates for foster, adoptive, and kinship families across Washington state.",,,,,No state-run photolisting found; AdoptUSKids used with state-specific info page. No local Heart Gallery chapter identified for WA. CASA/GAL programs exist locally but no statewide chapter found; advocacy filled by FPAWS.
VA|Virginia,VA,Virginia,Children Available for Adoption - Virginia Department of Social Services,https://www.dss.virginia.gov/family/ap/children_for_adoption.cgi,Virginia Department of Social Services,Foster Care,https://www.dss.virginia.gov/family/fc/index.cgi,The Heart Gallery - Paths for Families,https://pathsforfamilies.org/the-heart-gallery/,False,Bethany Christian Services of Virginia,https://www.dss.virginia.gov/facility/search/cpa.cgi?rm=Details;ID=26867;,christian_ministry,Christian child-placing agency providing foster care and adoption services in Virginia.,"People Places, Inc.",https://peopleplaces.org,placement_agency,Licensed nonprofit child-placing agency offering treatment foster care in Shenandoah Valley and Central Piedmont regions of Virginia.,Virginia CASA,https://virginiacasa.org,casa_gal,Recruits and trains volunteers to advocate for abused and neglected children in Virginia juvenile court proceedings.,,,,,DSS photolisting page active but no children listed in fetch (may require JS/cookies); Heart Gallery covers VA/MD/DC; Bethany verified via official DSS licensing page.
