entity,State Code,State Name,Photolisting Name,Photolisting URL,State Agency Name,State Agency Page Name,State Agency URL,Heart Gallery Name,Heart Gallery URL,Heart Gallery Is Regional Fallback,Org 1 Name,Org 1 URL,Org 1 Type,Org 1 Description,Org 2 Name,Org 2 URL,Org 2 Type,Org 2 Description,Org 3 Name,Org 3 URL,Org 3 Type,Org 3 Description,Org 4 Name,Org 4 URL,Org 4 Type,Org 4 Description,Research Notes
MO|Missouri,MO,Missouri,Missouri Heart Gallery,https://moheartgallery.org/search-the-kid/,Missouri Department of Social Services Children's Division,Becoming a Foster Parent,https://dss.mo.gov/cd/foster-care/becoming-a-foster-parent.htm,Missouri Heart Gallery,https://moheartgallery.org,False,One Heart Family Ministries,https://www.ohfm.org,christian_ministry,"Faith-based foster parent training, trauma support, and community for Missouri foster/adoptive families.",Lutheran Family and Children's Services,https://lfcsmo.org,placement_agency,"Provides foster care case management, adoption, and counseling services statewide for children in MO foster care.",Missouri CASA Association,https://www.mocasa.org,casa_gal,State association promoting and supporting local CASA programs advocating for abused/neglected kids in foster care.,Foster & Adoptive Care Coalition,https://www.foster-adopt.org,advocacy,Recruits and supports foster/adoptive families to create permanency for children impacted by foster care in Missouri.,"Photolisting is state-partnered Missouri Heart Gallery (DSS-linked, Raise the Future operated); no standalone state-run site found. Heart Gallery is local MO chapter. All URLs verified live via fetches/searches [dss.mo.gov](https://dss.mo.gov/cd/foster-care/becoming-a-foster-parent.htm), [moheartgallery.org](https://moheartgallery.org), [heartgalleryofamerica.org](https://heartgalleryofamerica.org/galleries/missouri/)."
AZ|Arizona,AZ,Arizona,Children's Heart Gallery,https://www.childrensheartgallery.org/,Arizona Department of Child Safety,Office of Licensing and Regulation,https://dcs.az.gov/olr,Children's Heart Gallery,https://www.childrensheartgallery.org/,False,Christian Family Care Agency,https://cfcare.org,christian_ministry,"Christian foster care and adoption agency providing licensure, training, and support for families in Arizona.",Arizona Children's Association,https://www.arizonaschildren.org,placement_agency,"Largest foster care provider in Arizona, offering training, support, and placement services for foster families statewide.",CASA of Arizona,https://www.azcourts.gov/CASA,casa_gal,Statewide program recruiting volunteers to advocate for abused and neglected children in Arizona foster care courts.,,,,,Children's Heart Gallery is the state-partnered photolisting run by DCS; gallery page requires filters but is official. State agency page is OLR for licensing. All URLs verified via search snippets as live.
MN|Minnesota,MN,Minnesota,Foster Adopt Minnesota Waiting Kids,https://www.fosteradoptmn.org/waiting-kids/,"Minnesota Department of Children, Youth, and Families",Licensing,https://dcyf.mn.gov/partners-and-providers/licensing,Minnesota Heart Gallery,http://www.minnesotaheartgallery.org,False,Bethany Christian Services,https://bethany.org/,christian_ministry,Christian foster care and adoption services with Minnesota locations supporting families and children in need.,Children's HeartLink Lutheran Social Service (CHLSS),https://chlss.org/,placement_agency,"Private agency contracted with state for foster care adoption, matching families with Minnesota waiting children.",CASA Minnesota,https://www.casamn.org,casa_gal,Recruits and supports volunteer Guardians ad Litem advocating for abused/neglected children in MN courts.,,,,,"Photolisting is state adoption exchange managed by Foster Adopt MN, semi-official. State agency page is general licensing info as no specific 'become foster parent' landing found; DCYF oversees with counties/private agencies licensing. Heart Gallery site active per recent images. CASA site may need confirmation."
MT|Montana,MT,Montana,AdoptUSKids Montana Waiting Children,https://www.adoptuskids.org/meet-the-children/search-for-children/search?state=MT,"Montana Department of Public Health and Human Services, Child and Family Services Division",Becoming a Foster Parent in Montana,https://dphhs.mt.gov/cfsd/fosterparent/,Heart Gallery of America,https://heartgalleryofamerica.org/,True,The Sacred Portion (HopeFull Connections),https://sacredportion.org/,christian_ministry,"Christian ministry providing foster care, adoption services, and support for vulnerable children in Montana.",Catholic Social Services of Montana,http://www.cssmt.org,placement_agency,"State-licensed private agency offering foster care, adoption, and family support services across Montana.",Montana CASA/GAL Association,https://www.mtcasa.org/,casa_gal,Statewide association supporting local CASA/GAL programs advocating for abused and neglected children in court.,Child Bridge Montana,https://www.childbridgemontana.org/,advocacy,"Nonprofit providing foster family recruitment, training, support, and child-specific matching services statewide.",No state-run photolisting found; state directs to AdoptUSKids. No local Heart Gallery chapter; national fallback used. CASA URL assumed from common pattern and LinkedIn refs; confirm live. Orgs from DPHHS licensed list and searches. All URLs need live verification.
ID|Idaho,ID,Idaho,Idaho Wednesday's Child,https://idahowednesdayschild.org/waiting-kids,Idaho Department of Health and Welfare,Apply to Become a Foster Parent,https://healthandwelfare.idaho.gov/services-programs/children-families-older-adults/child-and-family-services-and-foster-care/apply,Heart Gallery of America,https://heartgalleryofamerica.org/,True,IDFAPA,https://idfapa.org,advocacy,"Nonprofit improving care and support for foster and adoptive children and families statewide through resources, education, and awareness.",North Idaho CASA,https://www.northidahocasa.org,casa_gal,Recruits and trains volunteers to advocate in court for abused/neglected youth (0-23) in North Idaho's First Judicial District.,Idaho Youth Ranch,https://www.youthranch.org/,placement_agency,"Provides adoption services and youth shelter for at-risk children in Idaho, accredited for foster care support.",,,,,No local Heart Gallery chapter found; national fallback used. Photolisting photos require home study approval. No strong Christian ministry identified with state-specific foster focus; prioritized other types for variety. All URLs verified live. [Idaho research notes](file:///home/user/workspace/idaho_foster_research_notes.md)
DE|Delaware,DE,Delaware,Heart Gallery - DSCYF - State of Delaware,https://kids.delaware.gov/family-services/heartgallery/,"Delaware Department of Services for Children, Youth and their Families, Division of Family Services",Foster Care,https://kids.delaware.gov/family-services/foster-care/,Heart Gallery - DSCYF,https://kids.delaware.gov/family-services/heartgallery/,False,Bethany Christian Services Delaware,https://bethany.org/locations/us/delaware/delaware,christian_ministry,Christian nonprofit providing foster care and adoption from foster care services in Delaware.,Children's Choice of Delaware,https://www.childrenschoice.org/delaware-programs,placement_agency,Contracted Christian agency offering foster care placements and adoption services for Delaware child welfare children.,CASA Delaware,https://courts.delaware.gov/childadvocate/casa/,casa_gal,Official state CASA program providing volunteer advocates for abused/neglected children in foster care.,,,,,State Heart Gallery pages describe waiting children but show no photos/profiles (contact for info). No AdoptUSKids state-specific photolist found; state site preferred as semi-official.
IL|Illinois,IL,Illinois,Heart Gallery of Illinois,https://letitbeus.org/heart-gallery-of-illinois/,Illinois Department of Children and Family Services,Foster Care,https://dcfs.illinois.gov/loving-homes/fostercare.html,Heart Gallery of Illinois,https://letitbeus.org/heart-gallery-of-illinois/,False,Bethany Christian Services,https://bethany.org,christian_ministry,"Christian organization providing foster care, adoption, and family services across Illinois locations.",Let It Be Us,https://letitbeus.org/,placement_agency,Licensed child welfare agency operating Illinois Adoption Listing Service and Heart Gallery for foster-to-adopt matching.,Illinois CASA,https://illinoiscasa.org/,casa_gal,State network supporting local CASA/GAL programs advocating for abused/neglected children in Illinois child welfare cases.,,,,,Heart Gallery of Illinois is the official/semi-official photolisting promoted by DCFS; requires licensed foster parent registration for full access to profiles. Placement agencies like Let It Be Us contract with DCFS for licensing/recruitment. Bethany has IL offices for foster services. Illinois CASA site shows access issue but confirmed via [LinkedIn](https://www.linkedin.com/company/illinoiscasa) and state grants.
NH|New Hampshire,NH,New Hampshire,Adopt NH Our Waiting Children,https://www.adoptnh.org/our-waiting-children,"New Hampshire Department of Health and Human Services, Division for Children, Youth and Families (DCYF)",Foster Care and Adoption Services,https://www.dhhs.nh.gov/dcyf/programs-and-services/foster-care-and-adoption-services,Heart Gallery of America,https://heartgalleryofamerica.org/,True,Catholic Charities New Hampshire,https://www.cc-nh.org/,placement_agency,"Provides adoption services, family support, emergency shelter, and transitional housing for children and families in crisis.",CASA of New Hampshire,https://www.casanh.org/,casa_gal,Trained volunteer advocates represent abused and neglected children in court to ensure their best interests.,Life Connections,https://www.lifeconnectionsusa.org/new-hampshire-foster-care,placement_agency,Partners with DCYF to provide intensive and specialized foster care services for youth statewide.,,,,,"No local Heart Gallery chapter found; used national fallback. State agency foster recruitment page suspected at https://www.dhhs.nh.gov/dcyf/programs-and-services/foster-care-and-adoption-services but fetch failed (bad_robots); confirmed via multiple directories. Adopt NH is state-partnered semi-official photolisting legally free children via DCYF [AdoptUSKids](https://adoptuskids.org/adoption-and-foster-care/how-to-adopt-and-foster/state-information/new-hampshire), [Heart Gallery of America](https://heartgalleryofamerica.org/galleries/bookmarks/). No Christian ministry with dedicated foster focus found with live site; used strong placement agencies instead."
NM|New Mexico,NM,New Mexico,Heart Gallery of New Mexico,https://heartgallerynm.org,"New Mexico Children, Youth and Families Department",Foster Care in New Mexico,https://www.cyfd.nm.gov/foster-care-in-new-mexico/,Heart Gallery of New Mexico,https://heartgallerynm.org,False,New Mexico Christian Children's Home,https://www.nmcch.org,christian_ministry,"Provides homes, mentorship, and services for disadvantaged youth and young adults in foster care situations across New Mexico.",Red Mountain Family Services,https://redmountainfamilyservices.com,placement_agency,"Treatment foster placement agency serving New Mexico's foster children with care, therapy, and parent support since 2004.",New Mexico CASA Association,https://newmexicocasa.org,casa_gal,Supports 13 local CASA programs providing volunteer court advocacy for abused and neglected children in New Mexico.,,,,,State Heart Gallery site https://heartgallerynm.org listed by CYFD on Heart Gallery of America page but currently returns page not found; may be temporarily down. No active state-run photolisting found on CYFD site; AdoptUSKids NM page used as alternative info source but no direct photolist. Heart Gallery is CYFD-coordinated local chapter.
AR|Arkansas,AR,Arkansas,Arkansas Heart Gallery,https://www.theprojectzero.org/,"Arkansas Department of Human Services, Division of Children and Family Services",Foster Parent Pre-Application Process,https://everychildarkansas.org/all-about-foster-care/foster-parent-pre-application-process/,Arkansas Heart Gallery,https://www.theprojectzero.org/,False,The CALL in Arkansas,https://thecallinarkansas.org/,christian_ministry,"Christian organization recruiting, training, and supporting foster families across Arkansas counties.",Bethany Christian Services,https://bethany.org/,placement_agency,"Provides foster care, adoption, and family services with Arkansas office in Little Rock.",Arkansas CASA,https://arkansascasa.net/,casa_gal,State association coordinating CASA volunteers to advocate for abused/neglected children in foster care.,,,,,"Photolisting/Heart Gallery via Project Zero, state-partnered (featured on DHS site). Agency recruitment via Every Child Arkansas (.org contractor/partner per DHS PDFs and pages); no direct .gov 'become foster' landing found, noted as official channel [[DHS](https://dhs.arkansas.gov/dcfs/fcadoptinq/fca_inquiry.aspx), [PDF](https://humanservices.arkansas.gov/wp-content/uploads/RoadToFostering.FINAL_.pdf)]."
DC|District of Columbia,DC,District of Columbia,AdoptUSKids DC Page,https://adoptuskids.org/adoption-and-foster-care/how-to-adopt-and-foster/state-information/washington-dc,Child and Family Services Agency (CFSA),Become a Foster or Adoptive Parent,https://cfsa.dc.gov/service/become-foster-or-adoptive-parent,The Heart Gallery by Paths for Families,https://pathsforfamilies.org/the-heart-gallery/,True,DC127,https://www.dc127.org,christian_ministry,Mobilizes DC churches to provide wraparound support for families impacted by foster care.,CASA for Children of DC,https://www.casadc.org,casa_gal,Trains volunteer advocates to support abused/neglected children in DC foster care and juvenile justice.,National Center for Children and Families,https://nccf-cares.org/,placement_agency,"Private agency providing foster care and adoption services, contracts with CFSA for DC children placements.",,,,,"No state-run photolisting found; using AdoptUSKids DC info page as fallback. No local DC Heart Gallery; using regional MD/VA/DC serving gallery. Confirmed via CFSA site, AdoptUSKids, Heart Gallery of America."
MS|Mississippi,MS,Mississippi,Mississippi Heart Gallery,https://www.mdcps.ms.gov/heart-gallery,Mississippi Department of Child Protection Services,Foster Care,https://www.mdcps.ms.gov/programs/foster-care,Mississippi Heart Gallery,https://www.mdcps.ms.gov/heart-gallery,False,Bethany Christian Services,https://www.bethany.org,christian_ministry,"Christian organization providing foster care and adoption services through offices in Jackson, Hattiesburg, and Columbus, MS.",Southern Christian Services for Children and Youth,https://www.scscy.org,placement_agency,"Private agency offering foster care, adoption, and post-adoption support services across Mississippi with offices in Jackson, Gulfport, Tupelo.",CASA Mississippi,https://www.casams.org,casa_gal,Statewide network training volunteer advocates for abused and neglected children in foster care court proceedings.,,,,,Heart Gallery is state-run by MDCPS; no separate local chapter identified. All URLs confirmed live via searches and fetches. Research notes saved to ms_mississippi_foster_research_notes.md.
MI|Michigan,MI,Michigan,Michigan Heart Gallery,https://miheart.org,Michigan Department of Health and Human Services,Foster Care,https://www.michigan.gov/mdhhs/adult-child-serv/foster-care,Michigan Heart Gallery,https://www.mare.org/events-training/heart-gallery,False,Bethany Christian Services,https://bethany.org,christian_ministry,"Christian organization providing foster care, adoption, and family support services across Michigan.",Catholic Charities of Southeast Michigan,https://www.ccsem.org/adoption-and-foster-care,placement_agency,"Private agency offering foster care licensing, placements, and adoption services in Southeast Michigan.",Michigan CASA,https://michigancasa.org,casa_gal,Statewide association training volunteer advocates for abused and neglected children in foster care.,,,,,Photolisting via MARE/Heart Gallery; miheart.org lists waiting youth names. State agency oversees licensing via local offices/private CPAs. Heart Gallery active 2025 exhibit.
CA|California,CA,California,California Kids Connection,https://www.cakidsconnection.org,California Department of Social Services,Foster Care,https://www.cdss.ca.gov/inforesources/foster-care,Heart Gallery LA,https://heartgalleryla.org,True,Bethany Christian Services,https://bethany.org,christian_ministry,Christian organization providing foster care and adoption services in Southern California counties including Riverside and Ventura.,Aspiranet,https://www.aspiranet.org,placement_agency,"Licensed foster family agency contracting with counties to recruit, train, license, and place children in high-level foster care homes statewide.",California CASA,https://www.californiacasa.org,casa_gal,Statewide association supporting 44 local CASA programs serving foster youth in 53 counties through volunteer advocates.,Alliance for Children's Rights,https://allianceforchildrensrights.org,advocacy,"Provides free legal services, advocacy, and systemic reform for abused, neglected children and foster youth in Los Angeles County.",No single statewide Heart Gallery; Heart Gallery LA (Los Angeles) selected as prominent local chapter. California Kids Connection confirmed as state photolisting. All URLs live as of April 2026.
NV|Nevada,NV,Nevada,Clark County Adoption Profiles,https://www.clarkcountynv.gov/residents/family_services/divisions/adoption_program/profiles,Nevada Division of Child and Family Services,Become a Foster Parent (Clark County),https://www.clarkcountynv.gov/residents/family_services/divisions/foster-home-licensing,Heart Gallery Nevada,https://heartgalleryofamerica.org/galleries/nevada/,False,Nevada CASA,https://nvcasa.org,casa_gal,Recruits and trains Court Appointed Special Advocates for abused and neglected children in foster care across Nevada.,Catholic Charities of Southern Nevada,https://www.catholiccharities.com,placement_agency,Provides foster care and adoption services in Southern Nevada through private domestic agency contracting.,Raise the Future,https://www.raisethefuture.org,advocacy,Manages Nevada Heart Gallery and supports families adopting from foster care with training and resources.,Koinonia Family Services,https://kfh.org/nevada/,placement_agency,Provides specialized treatment foster care for children with complex needs in Nevada since 1994.,"No state-wide .gov photolisting found; used Clark County (majority of cases). No centralized state foster recruitment page; licensing county/DCFS-based. Christian ministry not clearly identified with foster focus; used strong placement agencies. Detailed notes saved to nevada_foster_research_notes.md. All URLs live per fetches [AdoptUSKids](https://adoptuskids.org/adoption-and-foster-care/how-to-adopt-and-foster/state-information/nevada), [Heart Gallery](https://heartgalleryofamerica.org/galleries/nevada/), county sites."
AL|Alabama,AL,Alabama,Heart Gallery of Alabama,https://heartgalleryalabama.com/the-children/,Alabama Department of Human Resources,Foster Care,https://dhr.alabama.gov/foster-care/,Heart Gallery Alabama,https://heartgalleryalabama.com,False,Alabama Baptist Children's Homes,https://www.alabamachild.org,christian_ministry,State's largest faith-based foster care provider protecting and restoring vulnerable children and families through Christ-centered services.,Lifeline Children's Services,https://lifelinechild.org,placement_agency,"Licensed non-profit child-placing agency in Alabama providing foster care training, adoption, and permanency services.",Alabama CASA Network,https://alabamacasa.org,casa_gal,State network of Court Appointed Special Advocates giving voice to abused and neglected children in foster care.,,,,,No state-run public photolisting found on DHR site despite FAQ mention of 'Waiting Children icon'; Heart Gallery used as semi-official. DHR foster page describes licensing process. Heart Gallery site live but children page currently shows no listings.
IA|Iowa,IA,Iowa,Meet Our Kids - Iowa Foster Care and Adoption,https://iowafosterandadoption.org/meet-iowas-amazing-kids/,Iowa Department of Health and Human Services,Foster Care & Adoption,https://hhs.iowa.gov/family-community/foster-care-adoption,Heart Gallery of America,https://heartgalleryofamerica.org/,True,Bethany Christian Services,https://bethany.org/locations/us/iowa,christian_ministry,Christian foster care and adoption agency with Iowa locations providing family services.,Four Oaks Family Connections,https://iowafosterandadoption.org/,placement_agency,"Statewide contractor recruiting, training, and matching foster/adoptive families with Iowa children.",Friends of Iowa CASA,https://www.iowacasafriends.org/,casa_gal,Nonprofit supporting CASA volunteers advocating for abused/neglected children in Iowa courts.,,,,,Photolisting is state-contractor (Four Oaks) partnered with HHS; no separate state-run listing or AdoptUSKids state page. Agency page general (no specific become-foster subpage found). No local Heart Gallery (historical mentions only); national fallback used. All URLs live as of Apr 2026.
LA|Louisiana,LA,Louisiana,Louisiana Heart Gallery,https://www.louisianaheartgallery.com,Louisiana Department of Children and Family Services,Foster Parenting: Qualifications and Steps,https://www.dcfs.louisiana.gov/page/197,Louisiana Heart Gallery,https://www.louisianaheartgallery.com,False,Louisiana Baptist Children's Home,https://www.lbch.org,christian_ministry,"Christian organization providing foster care, adoption services, and support for children in Louisiana foster system through Connect 1:27 ministry.",Catholic Charities Archdiocese of New Orleans,https://www.ccano.org,placement_agency,Contracts with DCFS to provide therapeutic foster homes and adoption services for children in foster care across Louisiana.,Louisiana CASA,https://www.louisianacasa.org,casa_gal,Statewide association supporting 18 local CASA programs that recruit and train volunteers to advocate for abused/neglected children in foster care.,,,,,"No state-run photolisting found on DCFS site; used semi-official Louisiana Heart Gallery (listed by AdoptUSKids, partners with DCFS). Heart Gallery site active but no current online child photos (traveling exhibit focus); directs to DCFS for adoption info [Louisiana Heart Gallery](https://www.louisianaheartgallery.com), [AdoptUSKids state photolists](https://adoptuskids.org/meet-the-children/search-for-children/state-photolists), [DCFS](https://www.dcfs.louisiana.gov)."
FL|Florida,FL,Florida,AdoptUSKids Florida page,https://adoptuskids.org/adoption-and-foster-care/how-to-adopt-and-foster/state-information/florida,Florida Department of Children and Families,Become a Foster Parent,https://www.myflfamilies.com/services/abuse-services/domestic-violence/programs/foster-care/how-do-I,Heart Gallery of America,https://heartgalleryofamerica.org/galleries/florida/,True,Lifeline Children's Services,https://lifelinechild.org/united-states/florida-state-offices/,christian_ministry,"Christian foster care and adoption ministry with offices in Pensacola, St. Johns, and Orlando serving Florida families.",Catholic Charities Diocese of St. Petersburg,https://www.ccdosp.org/adoption-services/,placement_agency,Private Catholic agency providing foster-to-adopt services and home studies in central/west Florida counties.,Florida Statewide Guardian ad Litem Office,https://guardianadlitem.org,casa_gal,"State program appointing volunteer advocates (GAL/CASA) for abused, neglected children in Florida dependency courts.",Florida Coalition for Children,https://flchildren.org,advocacy,Statewide nonprofit advocating for child welfare reforms and support for foster children and families in Florida.,"No state-run public photolisting found; recent FL law (HB 1083 2024) limits photo listings; used AdoptUSKids. Multiple regional Heart Galleries but no single state chapter, used national with FL list. All URLs verified live via searches as of 2026."
ME|Maine,ME,Maine,A Family for ME Maine Heart Gallery,https://afamilyformemaine.org/heart-gallery/,"Maine Department of Health and Human Services, Office of Child and Family Services",How to Become a Resource or Adoptive Parent,https://www.maine.gov/dhhs/ocfs/support-for-families/fostering-adopting/how-to-become-a-foster-or-adoptive-parent,Maine Heart Gallery,https://afamilyformemaine.org/heart-gallery/,False,Bethany Christian Services Maine,https://bethany.org/locations/us/me/farmington,christian_ministry,Christian organization offering foster care support services like Homebuilders and family strengthening in Maine.,Woodfords Family Services,https://www.woodfords.org/foster-care-and-adoption-programs/,placement_agency,Provides therapeutic foster care for children with disabilities in partnership with Maine DHHS.,Maine Court Appointed Special Advocates (CASA),https://www.courts.maine.gov/programs/casa.html,casa_gal,Recruits and trains volunteer guardians ad litem for children in Maine child protection and foster care cases.,,,,,"Photolisting via state-partnered A Family for ME (DHHS/Spurwink); main gallery page informational, profiles like Kalob exist. No dedicated AdoptUSKids ME page found. Heart Gallery local via same org. All URLs verified live via fetches/searches [Maine DHHS](https://www.maine.gov/dhhs/ocfs/support-for-families/fostering-adopting/how-to-become-a-foster-or-adoptive-parent), [A Family for ME](https://afamilyformemaine.org/heart-gallery/), [Heart Gallery of America Maine](https://heartgalleryofamerica.org/galleries/maine/), [AdoptUSKids state photolists](https://www.adoptuskids.org/meet-the-children/search-for-children/state-photolists)."
