TX|Texas,TX,Texas,Texas Adoption Resource Exchange (TARE),https://www.adoptchildren.org,Texas Department of Family and Protective Services,Get Started,https://www.dfps.texas.gov/Adoption_and_Foster_Care/Get_Started/,Heart Galleries of Texas,https://heartgallerytexas.org,False,Christian Homes & Family Services,https://christianhomes.com,christian_ministry,Christian foster-to-adopt ministry providing homes for children in East and West Texas foster care.,Buckner Children and Family Services,https://www.buckner.org,placement_agency,Private child-placing agency contracting with DFPS for foster care and adoption services statewide.,Texas CASA,https://texascasa.org,casa_gal,Statewide organization supporting local CASA programs advocating for abused and neglected children in court.,,,,,"TARE photolisting requires family account for full profiles; confirmed via DFPS pages [DFPS TARE](https://www.dfps.texas.gov/Adoption_and_Foster_Care/About_TARE/), [DFPS Contact](https://www.dfps.texas.gov/Adoption_and_Foster_Care/About_TARE/contact.asp). Buckner URL assumed from knowledge, verified in DFPS agency list [DFPS Agencies](https://www.dfps.texas.gov/adoption_and_foster_care/adoption_partners/private.asp). Heart Gallery is statewide coordinator with local chapters."
NC|North Carolina,NC,North Carolina,AdoptUSKids North Carolina page,https://adoptuskids.org/adoption-and-foster-care/how-to-adopt-and-foster/state-information/north-carolina,"North Carolina Department of Health and Human Services, Division of Social Services",Foster Care,https://www.ncdhhs.gov/divisions/social-services/child-welfare-services/foster-family-recruitment/foster-care,Heart Gallery of America,https://heartgalleryofamerica.org/galleries/northcarolina/,True,Bethany Christian Services,https://bethany.org/locations/us/north-carolina,christian_ministry,Christian foster care and adoption services with offices in Raleigh and Charlotte providing family support and placements.,Seven Homes,https://www.7homes.org,placement_agency,"Christian faith-centered foster care agency offering training, support, and placements for children in NC foster care.",Foster Family Alliance of NC,https://www.ffa-nc.org,advocacy,"Family-led nonprofit advocating for foster, kinship, and adoptive families statewide through education and policy work.",,,,,"No dedicated state-run photolisting site found; using AdoptUSKids state page. NC Kids program mentioned but no direct photolist. Heart Gallery NC is event-based, no active chapter site; using national fallback. No CASA state chapter site identified with foster focus."
KY|Kentucky,KY,Kentucky,KY FACES Waiting Children,https://prd.webapps.chfs.ky.gov/kyfaces,"Kentucky Cabinet for Health and Family Services, Department for Community Based Services",Foster & Adoption Certification Requirements,https://prd.webapps.chfs.ky.gov/kyfaces/Home/FosterAndAdoptionCertification,Heart Gallery of America,https://heartgalleryofamerica.org/,True,Sunrise Children's Services,https://www.sunrise.org/,christian_ministry,Christ-centered foster care agency providing therapeutic foster homes and support for children in foster care across Kentucky.,SAFY of Kentucky,https://www.safy.org/kentucky,placement_agency,Private foster care agency offering trauma-informed foster care services throughout multiple locations in Kentucky.,Kentucky CASA Network,https://kynonprofits.org/nonprofit-members/Details/kentucky-casa-network-602514,casa_gal,"Statewide association providing resources, technical assistance, and advocacy support to local CASA programs serving abused/neglected children in foster care.",,,,,No state-specific Heart Gallery chapter found; used national Heart Gallery of America as fallback. KY FACES site promotes foster/adoption but no direct photolisting visible on home/FAQs; used as semi-official based on multiple sources. State agency page is specific certification requirements on official KY site. CASA Network page from KY Nonprofits directory; confirmed active via LinkedIn profiles.
OH|Ohio,OH,Ohio,Ohio Adoption Photolist,https://fosterandadopt.dcy.ohio.gov/adoption/adoption-photolist/adoption-photolist-app,Ohio Department of Children and Youth,How to Become a Foster Parent in Ohio,https://fosterandadopt.dcy.ohio.gov/foster-care/becoming-a-foster-parent/how-to-become-a-foster-parent-in-ohio,Heart Gallery of America,https://heartgalleryofamerica.org/,True,Ohio CASA/GAL Association,https://ohiocasa.org/,casa_gal,State association supporting local CASA/GAL programs advocating for abused and neglected children in Ohio courts.,Bethany Christian Services,https://bethany.org/,christian_ministry,"Christian organization providing foster care and adoption services across Ohio, supporting families and children in need.",Pathway Caring for Children,https://www.pathwaycfc.org/,placement_agency,Private foster care agency serving 14 Northeast Ohio counties with traditional and treatment foster placements.,OhioGuidestone,https://ohioguidestone.org/services/family-mental-health-services/foster-care/,placement_agency,"Provides foster care services statewide for medically fragile children, teens, and sibling groups in Ohio.",No state-wide local Heart Gallery chapter found; using national Heart Gallery of America as fallback. Photolisting is state-run adoption profiles (non-photo). Ohio foster licensing handled by county PCSAs under DCY supervision. All URLs verified live via fetches/searches as of April 2026.
NY|New York,NY,New York,Heart Gallery New York,https://www.heartgallerynewyork.org/,New York State Office of Children and Family Services,Requirements to Become a Foster Parent,https://ocfs.ny.gov/programs/fostercare/requirements.php,Heart Gallery New York,https://www.heartgallerynewyork.org/,False,Bethany Christian Services,https://bethany.org/help-a-child/foster-care,christian_ministry,"Provides foster care services, training, and support for families across New York to care for children in crisis.",JCCA,https://www.jccany.org/our-programs/foster-care/,placement_agency,"Large NYC foster care agency placing children with families, offering training, support, and programs like Child Success NYC.",CASA of New York State,https://www.casanys.org,casa_gal,Recruits and supports CASA volunteers advocating for abused/neglected children in foster care across NY.,Adoptive and Foster Family Coalition of New York (AFFCNY),https://affcny.org,advocacy,"Provides support, resources, training, advocacy, and 24/7 helpline for foster, adoptive, and kinship families statewide.","OCFS child photolisting referenced but direct page not found (photolisting.asp 404); Heart Gallery New York is OCFS project and semi-official. State foster licensing via local districts per OCFS guidance. Heart Gallery NYC active but NYC-focused; used state version.[OCFS Disclaimer](https://ocfs.ny.gov/programs/adoption/disclaimer.php), [Heart Gallery NY](https://www.heartgallerynewyork.org/), [OCFS Requirements](https://ocfs.ny.gov/programs/fostercare/requirements.php)"
SD|South Dakota,SD,South Dakota,AdoptUSKids South Dakota page,https://www.adoptuskids.org/meet-the-children/children-in-foster-care/state-statistics/south-dakota,South Dakota Department of Social Services,Foster Parenting,https://dss.sd.gov/childprotection/fostercare/,South Dakota Heart Gallery,https://heartgalleryofamerica.org/galleries/southdakota/,True,Lutheran Social Services,https://lsssd.org/,placement_agency,"Private agency contracted by state for foster parent training, inquiry, and home studies in South Dakota.",Bethany Christian Services Sioux Falls,https://bethany.org/location/sioux-falls-south-dakota,christian_ministry,"Christian organization providing foster care, adoption, and pregnancy services in South Dakota.",South Dakota CASA,https://sdcasa.org,casa_gal,Statewide CASA programs appointing advocates for abused and neglected children in court.,Children's Home Society of South Dakota,https://chssd.org/,placement_agency,"Provides foster care, adoption, residential treatment, and Wendy's Wonderful Kids recruitment for waiting children in SD.",No state-run photolisting; DSS directs to AdoptUSKids. Heart Gallery page lists contact but no photos. Stronger Families Together (sd.gov) is key recruitment site. URLs verified via search snippets and fetches where possible.
NE|Nebraska,NE,Nebraska,Nebraska Department of Health and Human Services Children Available for Adoption,https://dhhs.ne.gov/Pages/Children-Available-for-Adoption.aspx,Nebraska Department of Health and Human Services,Foster Care,https://dhhs.ne.gov/Pages/Foster-Care.aspx,Nebraska Heart Gallery,https://www.nebraskaheartgallery.org/,False,Bethany Christian Services,https://www.bethany.org/,christian_ministry,Christian organization providing foster care and adoption services in Nebraska through licensed child placing agency.,Child Saving Institute,https://childsaving.org/,placement_agency,Licensed child placing agency offering foster care and adoption services for Nebraska children.,Christian Heritage,https://christianheritage.org/,christian_ministry,Christian children's home providing foster care and adoption services in Nebraska.,,,,,"No public photolisting found; DHHS page requires home study to inquire. Nebraska Heart Gallery site live but inactive (no listings, management ended). No AdoptUSKids state page listed. Org 3 URL assumed from searches, verify live. Limited CASA state site found; used placement agencies instead for variety. Heart Gallery not fallback as local chapter listed on official sources [DHHS Foster Care](https://dhhs.ne.gov/Pages/Foster-Care.aspx), [Heart Gallery of America](https://heartgalleryofamerica.org/galleries/nebraska/)."
WV|West Virginia,WV,West Virginia,Mission West Virginia Heart Gallery,https://heartgalleryofamerica.org/galleries/westvirginia/,"West Virginia Department of Human Services, Bureau for Children and Families",Foster Care Coalition Recruitment Campaign,https://dhhr.wv.gov/News/2024/Pages/Foster-Care-Coalition-Launches-Statewide-Recruitment-Campaign-to-Address-Foster-Parent-Shortage.aspx,Mission West Virginia Heart Gallery,https://heartgalleryofamerica.org/galleries/westvirginia/,False,Bethany Christian Services Martinsburg,https://www.bethany.org/martinsburg,christian_ministry,"Christian foster care and adoption agency with office in Martinsburg, WV contracting for domestic placements.",Children's Home Society of West Virginia,https://childhswv.org,placement_agency,"Statewide private agency providing foster care, adoption, and counseling services throughout WV.",TEAM for West Virginia Children - Western Regional CASA,https://teamwv.org/western-regional-casa/,casa_gal,Regional CASA program recruiting volunteer advocates for abused and neglected children in court.,Burlington United Methodist Family Services,http://www.bumfs.org/,placement_agency,"Faith-based agency offering foster care, adoption, and kinship support services in northern WV.","No active state-run photolisting found; Mission WV (state partner) Heart Gallery used, page lists sponsor/contact but no photos. State .gov lacks dedicated foster recruitment page, uses news linking to wefosterwv.org (Mission WV); policy confirms BCF handles licensing mainly for kinship, private agencies for general foster. adoptwvchild.org not resolving. Heart Gallery local via Mission WV."
IN|Indiana,IN,Indiana,Indiana's Waiting Children - Indiana Adoption Program,https://www.indianaadoptionprogram.org/indianas-waiting-children/,Indiana Department of Child Services,Foster/Relative Licensing and Placement Forms,https://www.in.gov/dcs/foster-and-kinship-care/foster-care/fosterrelative-licensing-and-placement-forms/,Heart Gallery of America,https://heartgalleryofamerica.org/,True,Lifeline Youth & Family Services,https://lifelineyouth.org,christian_ministry,"Provides adoption & guardianship support, family preservation, and home-based services for foster and kinship families across Indiana communities.",Catholic Charities Diocese of Fort Wayne-South Bend,https://www.ccfwsb.org/adoption-pregnancy-counseling,placement_agency,"Licensed child-placing agency offering foster care, adoption services, and support for children in northern Indiana counties.",Indiana State Office of GAL/CASA,https://www.in.gov/courts/iocs/galcasa/,casa_gal,State office overseeing GAL/CASA programs that provide court advocates for abused and neglected children statewide.,,,,,No dedicated local Heart Gallery chapter found with live website; used national fallback. State agency page is forms list as specific foster recruitment page not clearly identified. Photolisting confirmed via DCS references. Org 1 assumed Christian based on name similarity to Lifeline Christian Services.
UT|Utah,UT,Utah,Utah's Adoption Connection Heart Gallery,https://www.utahadopt.org/building-your-family/heart-gallery,Utah Division of Child and Family Services,Foster Care,https://dcfs.utah.gov/services/foster-care/,Utah Heart Gallery,https://www.utahadopt.org/building-your-family/heart-gallery,False,Utah Foster Care Foundation,https://utahfostercare.org/,placement_agency,"State-contracted agency for recruiting, training, and supporting foster and adoptive families statewide.",Utah CASA,https://www.utahcasa.org,casa_gal,Statewide Court Appointed Special Advocate program advocating for abused and neglected children in court.,Bethany Christian Services,https://bethany.org/,christian_ministry,"Christian organization providing foster care, adoption, and family support services with presence in Utah.",,,,,Heart Gallery page appears to have older photos (e.g. photographers like Bry Cox); Utah's Adoption Connection partners with DCFS. No direct AdoptUSKids state page found; used semi-official partner photolisting. State agency directs to Utah Foster Care for recruitment. Bethany used as Christian ministry; local chapter not distinctly separate.
WY|Wyoming,WY,Wyoming,Raise the Future Wyoming Waiting Children,https://www.raisethefuture.org/waiting-children,Wyoming Department of Family Services,Wyoming Foster Care Frequently Asked Questions,https://dfs.wyo.gov/services/child-youth-services/foster-care-foster-care-training/wyoming-foster-care-frequently-asked-questions/,Heart Gallery of America,https://heartgalleryofamerica.org/,True,Bethany Christian Services Wyoming,https://www.bethany.org/,christian_ministry,Christian organization providing foster care and adoption services in Wyoming through local office in Cheyenne.,Catholic Charities of Wyoming,http://www.charitieswyoming.org,placement_agency,Provides foster care and adoption services for children in Wyoming.,CASA of Natrona County,https://www.casaofnatronacounty.net,casa_gal,"Court Appointed Special Advocates for abused and neglected children in foster care in Natrona County, Wyoming.",Wyoming Children's Society,https://www.wyomingcs.org/,placement_agency,Private agency offering waiting child adoption and foster care services in Wyoming.,No state-run photolisting; using regional Raise the Future as recommended by DFS. No local Heart Gallery; national fallback. No single state CASA; used county-level. Bethany Wyoming contact from official directory [Heart Gallery of America directory](https://heartgalleryofamerica.org/adoption/state-links/wy-directory/). Catholic Charities URL from directory. All URLs live per searches.
AK|Alaska,AK,Alaska,Heart Gallery of Alaska,https://www.heartgalleryak.com,"Alaska Department of Family and Community Services, Office of Children's Services",Requirements to Become a Foster Parent,https://dfcs.alaska.gov/ocs/Pages/fostercare/ready.aspx,Heart Gallery of Alaska,https://www.heartgalleryak.com,False,Royal Family KIDS Camp Anchorage,https://www.royalfamilykidsanchorage.org,christian_ministry,"Christian camp ministry providing trauma-informed summer camps for abused and neglected foster children in Alaska, mobilizing church communities.",Alaska CASA,https://www.alaskacasa.org/,casa_gal,Recruits and trains community volunteers to serve as court-appointed advocates for abused and neglected children in Alaska's child welfare system.,Facing Foster Care in Alaska (FFCA),https://www.ffcalaska.org,advocacy,"Statewide network of current and former foster youth leading advocacy, training, peer support, and basic needs assistance for foster kids in Alaska.",,,,,"Heart Gallery of Alaska site live but no visible child profiles on homepage (may require navigation/orientation); state-endorsed on official DFCS site. No specific private placement agency names found in official lists; ACRF is recruitment partner, not placement. No Bethany/Lifeline chapter in AK."
